{
  "$schema": "https://json-schema.org/draft/2020-12/schema",
  "$id": "https://amd.com/cvs/rundeck/profile.schema.json",
  "title": "CVS Run Deck profile",
  "type": "object",
  "required": ["schema_version", "profile_id", "suite_id", "report_basename", "dataset_builder", "sources", "cards"],
  "properties": {
    "schema_version": { "type": "integer", "const": 1 },
    "profile_id": { "type": "string" },
    "suite_id": { "type": "string" },
    "metric_contract": {
      "type": "object",
      "required": ["id", "version"],
      "additionalProperties": false,
      "properties": {
        "id": { "type": "string" },
        "version": { "type": "integer", "minimum": 1 }
      }
    },
    "report_basename": { "type": "string" },
    "title": { "type": "string" },
    "subtitle": { "type": "string" },
    "footer": { "type": "string" },
    "link_name": { "type": "string" },
    "extends": { "type": "string", "description": "Stem of another profile JSON to merge before this one (child wins)." },
    "dataset_builder": { "enum": ["sweep", "series", "matrix", "status_matrix", "training_sweep"] },
    "interactive_viewer": { "type": "boolean" },
    "viewer_cell_threshold": { "type": "integer", "minimum": 1 },
    "sources": {
      "type": "object",
      "required": ["results"],
      "properties": {
        "results": { "type": "string" },
        "variant": { "type": "string" },
        "lifecycle": { "type": "string" },
        "reference": { "type": "string" }
      }
    },
    "hooks": {
      "type": "object",
      "properties": {
        "tier_metric_specs": { "type": "string" },
        "metric_units": { "type": "string" },
        "metric_categories": { "type": "string" },
        "metric_verdict": { "type": "string" },
        "run_card_display": { "type": "string" },
        "launch_provenance": { "type": "string" },
        "cell_dimensions": { "type": "string" },
        "series_extras": {
          "type": "string",
          "description": "series builder: callable(results, variant) whose dict merges into datasets.series."
        }
      }
    },
    "cards": {
      "type": "array",
      "items": {
        "type": "object",
        "required": ["type", "bind"],
        "properties": {
          "type": { "type": "string" },
          "bind": { "type": "string" },
          "id": { "type": "string" },
          "title": { "type": "string" },
          "hint": {
            "type": "string",
            "description": "Optional help line. status_matrix shows this instead of the generic item-breakdown hint."
          },
          "when_empty": { "enum": ["hide"] },
          "collapsed": {
            "type": ["boolean", "string"],
            "description": "Fold the card body into a closed <details>; a string is the summary label."
          },
          "columns_from": { "type": "string" },
          "empty_message": { "type": "string", "description": "table: text shown when the table has no rows." }
        }
      }
    },
    "sweep": { "type": "object" },
    "viewer": {
      "type": "object",
      "properties": {
        "group_by": { "type": "array", "items": { "type": "string" } },
        "filters": { "type": "array", "items": { "type": "string" } },
        "heatmap_metrics": { "type": "array", "items": { "type": "string" } },
        "margin_metrics": { "type": "array", "items": { "type": "string" } },
        "default_heatmap_metric": { "type": "string" },
        "default_margin_metric": { "type": "string" },
        "heatmap_row_fields": { "type": "array", "items": { "type": "string" } },
        "concurrency_field": { "type": "string" },
        "comparison_hint": { "type": "string" },
        "sweep_charts": {
          "type": "object",
          "properties": {
            "enabled": { "type": "boolean" }
          }
        },
        "table_columns": { "type": "array" },
        "metrics": { "type": "object" },
        "interactivity": {
          "type": "object",
          "properties": {
            "enabled": { "type": "boolean" },
            "tpot_metric": { "type": "string" },
            "output_throughput_metric": { "type": "string" },
            "total_throughput_metric": { "type": "string" },
            "title": { "type": "string" },
            "hint": { "type": "string" }
          }
        }
      }
    },
    "series": { "type": "object" },
    "matrix": { "type": "object" },
    "lifecycle": { "type": "object" },
    "behavior": { "type": "object" }
  }
}
