{
  "schema_version": 1,
  "profile_id": "vllm_rundeck",
  "suite_id": "vllm",
  "metric_contract": {"id": "vllm-bare", "version": 1},
  "report_basename": "vllm_run_deck",
  "title": "vLLM Run Deck",
  "subtitle": "vLLM · single-node & PP-distributed lab performance summary",
  "footer": "CVS vllm · render-only · does not affect gates",
  "link_name": "vLLM Run Deck",
  "dataset_builder": "sweep",
  "interactive_viewer": true,
  "viewer_cell_threshold": 24,
  "sources": {
    "results": "cvs_results_dict",
    "variant": "variant_config",
    "lifecycle": "lifecycle"
  },
  "hooks": {
    "tier_metric_specs": "cvs.lib.inference.utils.vllm_metrics:tier_metric_specs",
    "metric_units": "cvs.lib.inference.utils.vllm_metrics:METRIC_UNITS",
    "metric_categories": "cvs.lib.inference.utils.vllm_metrics:METRIC_CATEGORIES",
    "metric_verdict": "cvs.lib.inference.utils.vllm_metrics:metric_verdict"
  },
  "sweep": {
    "metric_prefix": "",
    "throughput_metric": "output_throughput",
    "ttft_metric": "mean_ttft_ms",
    "headline_metric": "output_throughput",
    "results_table_columns": [
      ["Model", null],
      ["GPU", null],
      ["ISL", null],
      ["OSL", null],
      ["Policy", null],
      ["Conc", null],
      ["Host", null],
      ["Req/s", "request_throughput"],
      ["Total tok/s", "total_token_throughput"],
      ["Mean TTFT (ms)", "mean_ttft_ms"],
      ["P95 TTFT (ms)", "p95_ttft_ms"],
      ["Mean TPOT (ms)", "mean_tpot_ms"],
      ["P95 TPOT (ms)", "p95_tpot_ms"],
      ["P99 ITL (ms)", "p99_itl_ms"],
      ["Goodput (req/s)", "goodput"]
    ],
    "cell_highlights": [
      ["output_throughput", "Output tok/s"],
      ["total_token_throughput", "Total tok/s"],
      ["mean_ttft_ms", "Mean TTFT (ms)"],
      ["mean_tpot_ms", "Mean TPOT (ms)"],
      ["p99_ttft_ms", "P99 TTFT (ms)"],
      ["p95_tpot_ms", "P95 TPOT (ms)"]
    ],
    "chart_series": [
      {"metric_suffix": "output_throughput", "title": "Output tok/s", "unit": "tok/s", "invert": false},
      {"metric_suffix": "total_token_throughput", "title": "Total tok/s", "unit": "tok/s", "invert": false},
      {"metric_suffix": "mean_ttft_ms", "title": "Mean TTFT", "unit": "ms", "invert": true},
      {"metric_suffix": "mean_tpot_ms", "title": "Mean TPOT", "unit": "ms", "invert": true},
      {"metric_suffix": "p99_ttft_ms", "title": "P99 TTFT", "unit": "ms", "invert": true},
      {"metric_suffix": "p99_tpot_ms", "title": "P99 TPOT", "unit": "ms", "invert": true},
      {"metric_suffix": "p99_itl_ms", "title": "P99 ITL", "unit": "ms", "invert": true}
    ]
  },
  "lifecycle": {
    "session_labels": [
      "container_launch",
      "topology_discovery",
      "model_fetch",
      "openai_smoke",
      "server_ready",
      "teardown"
    ],
    "cell_labels": ["server_ready"]
  },
  "behavior": {
    "inference_test_substring": "test_vllm_inference",
    "row_card_extras": true,
    "row_card_test_names": ["test_vllm_inference"]
  },
  "viewer": {
    "interactivity": {
      "enabled": true,
      "tpot_metric": "mean_tpot_ms",
      "output_throughput_metric": "output_throughput",
      "total_throughput_metric": "total_token_throughput"
    }
  },
  "cards": [
    {"type": "run_card", "id": "run-card", "title": "Run card", "bind": "run_card_display"},
    {"type": "lifecycle_timeline", "id": "lifecycle", "title": "Lifecycle timeline", "bind": "lifecycle"},
    {"type": "sweep_analytics", "id": "sweep", "title": "Sweep analytics", "bind": "datasets.sweep"},
    {"type": "gate_matrix", "id": "gates", "title": "Gate matrix", "bind": "gate_matrix"},
    {"type": "gate_heatmap", "bind": "gate_matrix", "when_empty": "hide"},
    {"type": "sweep_cell_cards", "id": "cells", "title": "Sweep cells", "bind": "cells"},
    {"type": "table", "id": "results", "title": "Full results", "bind": "results_table"}
  ]
}
